{
  "metadata": {
    "ip_name": "rv32im_core",
    "spec_revision": "0.3",
    "phase": 1,
    "gate_status": "approved",
    "approved_at": "2026-08-21T22:05:58+07:00",
    "source_spec": "spec_parser.md",
    "gate_1_approved": true
  },
  "requirements": [
    {
      "req_id": "REQ-001",
      "text": "RV32I base integer instruction set — 40 lệnh, liệt kê đầy đủ ở §1.1.1 (37 lệnh cơ bản + FENCE + ECALL + EBREAK). FENCE.I/CSRR*/MRET/WFI KHÔNG tính vào 40.",
      "category": "functional",
      "ambiguity_score": 0.05,
      "needs_review": false,
      "needs_human_decision": false,
      "source_section": "§1.1 F01 / §1.1.1",
      "sva_hint": "property",
      "rtl_modules": [
        "rv32im_decoder (U05)",
        "rv32im_imm_gen (U06)",
        "rv32im_alu (U09)",
        "rv32im_branch_unit (U10)",
        "rv32im_lsu (U15)"
      ],
      "parameters_affected": [],
      "feature_id": "F01"
    },
    {
      "req_id": "REQ-002",
      "text": "RV32M: MUL MULH MULHSU MULHU DIV DIVU REM REMU",
      "category": "functional",
      "ambiguity_score": 0.08,
      "needs_review": false,
      "needs_human_decision": false,
      "source_section": "§1.1 F02",
      "sva_hint": "property",
      "rtl_modules": [
        "rv32im_decoder (U05)",
        "rv32im_muldiv (U11)",
        "rv32im_mult (U12)",
        "rv32im_div (U13)"
      ],
      "parameters_affected": [
        "PR_M_EXT_EN"
      ],
      "feature_id": "F02"
    },
    {
      "req_id": "REQ-003",
      "text": "Zicsr: CSRRW/S/C, CSRRWI/SI/CI",
      "category": "functional",
      "ambiguity_score": 0.08,
      "needs_review": false,
      "needs_human_decision": false,
      "source_section": "§1.1 F03",
      "sva_hint": "property",
      "rtl_modules": [
        "rv32im_decoder (U05)",
        "rv32im_csr_file (U16)",
        "rv32im_mem_stage (U14)"
      ],
      "parameters_affected": [
        "PR_CSR_EN"
      ],
      "feature_id": "F03"
    },
    {
      "req_id": "REQ-004",
      "text": "Zifencei: FENCE.I — flush pipeline và refetch từ pc+4",
      "category": "functional",
      "ambiguity_score": 0.1,
      "needs_review": false,
      "needs_human_decision": false,
      "source_section": "§1.1 F04",
      "sva_hint": "property",
      "rtl_modules": [
        "rv32im_decoder (U05)",
        "rv32im_trap_ctrl (U17)",
        "rv32im_if_stage (U03)"
      ],
      "parameters_affected": [],
      "feature_id": "F04"
    },
    {
      "req_id": "REQ-005",
      "text": "Pipeline 5 tầng in-order, single-issue",
      "category": "functional",
      "ambiguity_score": 0.1,
      "needs_review": false,
      "needs_human_decision": false,
      "source_section": "§1.1 F05",
      "sva_hint": "property",
      "rtl_modules": [
        "rv32im_core (U02)",
        "rv32im_if_stage (U03)",
        "rv32im_id_stage (U04)",
        "rv32im_ex_stage (U08)",
        "rv32im_mem_stage (U14)"
      ],
      "parameters_affected": [],
      "feature_id": "F05"
    },
    {
      "req_id": "REQ-006",
      "text": "Full forwarding EX/MEM → EX và MEM/WB → EX",
      "category": "functional",
      "ambiguity_score": 0.1,
      "needs_review": false,
      "needs_human_decision": false,
      "source_section": "§1.1 F06",
      "sva_hint": "property",
      "rtl_modules": [
        "rv32im_hazard_ctrl (U18)",
        "rv32im_ex_stage (U08)"
      ],
      "parameters_affected": [
        "PR_FWD_EN"
      ],
      "feature_id": "F06"
    },
    {
      "req_id": "REQ-007",
      "text": "Load-use interlock — stall khi consumer đứng ngay sau load",
      "category": "functional",
      "ambiguity_score": 0.1,
      "needs_review": false,
      "needs_human_decision": false,
      "source_section": "§1.1 F07",
      "sva_hint": "property",
      "rtl_modules": [
        "rv32im_hazard_ctrl (U18)"
      ],
      "parameters_affected": [],
      "feature_id": "F07"
    },
    {
      "req_id": "REQ-008",
      "text": "Branch resolve tại tầng EX, static predict-not-taken",
      "category": "functional",
      "ambiguity_score": 0.1,
      "needs_review": false,
      "needs_human_decision": false,
      "source_section": "§1.1 F08",
      "sva_hint": "property",
      "rtl_modules": [
        "rv32im_ex_stage (U08)",
        "rv32im_branch_unit (U10)",
        "rv32im_if_stage (U03)"
      ],
      "parameters_affected": [],
      "feature_id": "F08"
    },
    {
      "req_id": "REQ-009",
      "text": "Regfile 32×32, x0 hardwired 0, write-first bypass",
      "category": "functional",
      "ambiguity_score": 0.08,
      "needs_review": false,
      "needs_human_decision": false,
      "source_section": "§1.1 F09",
      "sva_hint": "property",
      "rtl_modules": [
        "rv32im_regfile (U07)"
      ],
      "parameters_affected": [
        "PR_RF_IMPL"
      ],
      "feature_id": "F09"
    },
    {
      "req_id": "REQ-010",
      "text": "I-bus / D-bus tách rời (Harvard), valid-ready handshake",
      "category": "functional",
      "ambiguity_score": 0.08,
      "needs_review": false,
      "needs_human_decision": false,
      "source_section": "§1.1 F10",
      "sva_hint": "property",
      "rtl_modules": [
        "rv32im_core (U02)",
        "rv32im_if_stage (U03)",
        "rv32im_mem_stage (U14)"
      ],
      "parameters_affected": [],
      "feature_id": "F10"
    },
    {
      "req_id": "REQ-011",
      "text": "M-mode CSR file — 16 CSR theo §16.4",
      "category": "functional",
      "ambiguity_score": 0.08,
      "needs_review": false,
      "needs_human_decision": false,
      "source_section": "§1.1 F11",
      "sva_hint": "property",
      "rtl_modules": [
        "rv32im_csr_file (U16)"
      ],
      "parameters_affected": [
        "PR_CSR_EN"
      ],
      "feature_id": "F11"
    },
    {
      "req_id": "REQ-012",
      "text": "Precise exception, commit point tại tầng MEM",
      "category": "functional",
      "ambiguity_score": 0.15,
      "needs_review": false,
      "needs_human_decision": false,
      "source_section": "§1.1 F12",
      "sva_hint": "property",
      "rtl_modules": [
        "rv32im_trap_ctrl (U17)",
        "rv32im_mem_stage (U14)"
      ],
      "parameters_affected": [],
      "feature_id": "F12"
    },
    {
      "req_id": "REQ-013",
      "text": "9 exception đồng bộ (ECALL/EBREAK/illegal/misaligned/access fault)",
      "category": "functional",
      "ambiguity_score": 0.08,
      "needs_review": false,
      "needs_human_decision": false,
      "source_section": "§1.1 F13",
      "sva_hint": "property",
      "rtl_modules": [
        "rv32im_trap_ctrl (U17)",
        "rv32im_if_stage (U03)",
        "rv32im_id_stage (U04)",
        "rv32im_ex_stage (U08)",
        "rv32im_mem_stage (U14)"
      ],
      "parameters_affected": [],
      "feature_id": "F13"
    },
    {
      "req_id": "REQ-014",
      "text": "3 interrupt M-mode (software/timer/external), level-sensitive",
      "category": "functional",
      "ambiguity_score": 0.1,
      "needs_review": false,
      "needs_human_decision": false,
      "source_section": "§1.1 F14",
      "sva_hint": "property",
      "rtl_modules": [
        "rv32im_csr_file (U16)",
        "rv32im_trap_ctrl (U17)"
      ],
      "parameters_affected": [
        "PR_IRQ_EN"
      ],
      "feature_id": "F14"
    },
    {
      "req_id": "REQ-015",
      "text": "MRET khôi phục mstatus.MIE và PC",
      "category": "functional",
      "ambiguity_score": 0.08,
      "needs_review": false,
      "needs_human_decision": false,
      "source_section": "§1.1 F15",
      "sva_hint": "property",
      "rtl_modules": [
        "rv32im_decoder (U05)",
        "rv32im_csr_file (U16)",
        "rv32im_trap_ctrl (U17)"
      ],
      "parameters_affected": [
        "PR_CSR_EN"
      ],
      "feature_id": "F15"
    },
    {
      "req_id": "REQ-016",
      "text": "mcycle / minstret 64-bit",
      "category": "functional",
      "ambiguity_score": 0.1,
      "needs_review": false,
      "needs_human_decision": false,
      "source_section": "§1.1 F16",
      "sva_hint": "property",
      "rtl_modules": [
        "rv32im_csr_file (U16)"
      ],
      "parameters_affected": [
        "PR_COUNTER_EN"
      ],
      "feature_id": "F16",
      "optional": true
    },
    {
      "req_id": "REQ-017",
      "text": "MULDIV multi-cycle, stall tầng EX, special case bit-exact",
      "category": "functional",
      "ambiguity_score": 0.1,
      "needs_review": false,
      "needs_human_decision": false,
      "source_section": "§1.1 F17",
      "sva_hint": "property",
      "rtl_modules": [
        "rv32im_muldiv (U11)",
        "rv32im_mult (U12)",
        "rv32im_div (U13)",
        "rv32im_ex_stage (U08)"
      ],
      "parameters_affected": [
        "PR_MULT_IMPL",
        "PR_DIV_IMPL"
      ],
      "feature_id": "F17"
    },
    {
      "req_id": "REQ-018",
      "text": "Retire trace port cho co-simulation với ISS",
      "category": "functional",
      "ambiguity_score": 0.1,
      "needs_review": false,
      "needs_human_decision": false,
      "source_section": "§1.1 F18",
      "sva_hint": "cover",
      "rtl_modules": [
        "rv32im_mem_stage (U14)",
        "rv32im_core (U02)"
      ],
      "parameters_affected": [
        "PR_TRACE_EN"
      ],
      "feature_id": "F18",
      "optional": true
    },
    {
      "req_id": "REQ-019",
      "text": "mtvec Vectored mode",
      "category": "functional",
      "ambiguity_score": 0.12,
      "needs_review": false,
      "needs_human_decision": false,
      "source_section": "§1.1 F19",
      "sva_hint": "property",
      "rtl_modules": [
        "rv32im_csr_file (U16)",
        "rv32im_trap_ctrl (U17)"
      ],
      "parameters_affected": [
        "PR_MTVEC_VEC_EN"
      ],
      "feature_id": "F19",
      "optional": true
    },
    {
      "req_id": "REQ-020",
      "text": "C1: PR_BOOT_ADDR[1:0] == 2'b00",
      "category": "constraint",
      "ambiguity_score": 0.05,